text,startpos,endpos,frequency,passage_type
" ich dir geboren habe, in deinem Herzen trägst; wenn wir nicht im voraus schon, um welcher Ursach willen, weiß ich nicht, verstoßen sind: so sage mir, was diese entsetzlichen Anstalten zu bedeuten haben! Kohlhaas sagte: liebstes Weib, nichts, das dich noch, so wie die Sachen stehn, beunruhigen dürfte. Ich habe eine Resolution erhalten, in welcher man mir sagt, daß meine ",42571,42944,0.0,not_cited
Klage gegen den Junker Wenzel von Tronka eine nichtsnutzige Stänkerei sei.,42944,43018,12.857142857142858,cited
 Und weil hier ein Mißverständnis obwalten muß: ,43018,43066,0.0,not_cited
"so habe ich mich entschlossen, meine Klage noch einmal, persönlich bei dem Landesherrn selbst, einzureichen.",43066,43174,1.75,cited
" – Warum willst du dein Haus verkaufen? rief sie, indem sie mit einer verstörten Gebärde, aufstand. Der Roßkamm, indem er sie sanft an seine Brust drückte, erwiderte: ",43174,43341,0.0,not_cited
"weil ich in einem Lande, liebste Lisbeth, in welchem man mich, in meinen Rechten, nicht schützen will, nicht bleiben mag. Lieber ein Hund sein, wenn ich von Füßen getreten werden soll, als ein Mensch!",43341,43541,3.0,cited
" Ich bin gewiß, daß meine Frau hierin so denkt, als ich. – Woher weißt du, fragte jene wild, daß man dich in deinen Rechten nicht schützen wird? Wenn du dem Herrn bescheiden, wie es dir zukommt, mit deiner Bittschrift nahst: woher weißt du, daß ",43541,43786,0.0,not_cited
"sie beiseite geworfen, oder mit Verweigerung, dich zu hören, beantwortet werden wird?",43786,43871,1.0,cited
" – Wohlan, antwortete Kohlhaas, wenn meine Furcht hierin ungegründet ",43871,43940,0.0,not_cited
"ist, so ist auch",43940,43956,1.0,cited
 mein Haus noch nicht verkauft. ,43956,43988,0.0,not_cited
"Der Herr selbst, weiß ich, ist gerecht; und wenn es mir nur gelingt, durch die, die ihn umringen, bis an seine Person zu kommen, so zweifle ich nicht, ich verschaffe mir Recht, und kehre fröhlich, noch ehe die Woche verstreicht, zu dir und meinen alten Geschäften zurück.",43988,44259,3.8,cited
" Möcht ich alsdann noch, setzt' er hinzu, indem er sie küßte, bis an das Ende meines Lebens bei dir verharren! – Doch ratsam ist es, fuhr er fort, daß ich mich auf jeden Fall gefaßt mache; und daher wünschte ich, daß du dich, auf einige Zeit, wenn es sein kann, entferntest, und mit den Kindern zu deiner Muhme nach Schwerin gingst, die du überdies längst hast besuchen wollen. – Wie? rief die Hausfrau. Ich soll nach Schwerin gehen? Über die Grenze mit den Kindern, zu meiner Muhme nach Schwerin? Und das Entsetzen erstickte ihr die Sprache. – Allerdings, antwortete Kohlhaas, und das, wenn es sein kann, gleich, damit ich in den Schritten, die ich für meine Sache tun will, durch keine Rücksichten gestört werde. – »",44259,44977,0.0,not_cited
"Oh! ich verstehe dich!« rief sie. »Du brauchst jetzt nichts mehr, als Waffen und Pferde; alles andere kann nehmen, wer will!",44977,45101,1.5,cited
"« Und damit wandte sie sich, warf sich auf einen Sessel nieder, und weinte. – Kohlhaas sagte betroffen: liebste Lisbeth, was machst du? Gott hat mich mit Weib und Kindern und Gütern gesegnet; soll ich heute zum erstenmal wünschen, daß es anders wäre? – – – Er setzte sich zu ihr, die ihm, bei diesen Worten, errötend um den Hals gefallen war, freundlich nieder. – Sag mir an, sprach er, indem er ihr die Locken von der Stirne strich: was soll ich tun? Soll ich meine Sache aufgeben? Soll ich nach der Tronkenburg gehen, und den Ritter bitten, daß er mir die Pferde wiedergebe, mich aufschwingen, und sie dir herreiten? – ",45101,45722,0.0,not_cited
Lisbeth wagte nicht: ja! ja! ja! zu sagen – sie schüttelte weinend mit dem Kopf,45722,45801,1.5,cited
", sie drückte ihn heftig an sich, und überdeckte mit heißen Küssen seine Brust »Nun also!« rief Kohlhaas. »",45801,45908,0.0,not_cited
"Wenn du fühlst, daß mir, falls ich mein Gewerbe forttreiben soll, Recht werden muß: so gönne mir auch die Freiheit, die mir nötig ist, es mir zu verschaffen!",45908,46065,2.5,cited
"« Und damit stand er auf, und sagte dem Knecht, der ihm meldete, daß der Fuchs gesattelt stünde: morgen müßten auch die Braunen eingeschirrt werden, um seine Frau nach Schwerin zu führen. Lisbeth sagte: sie habe einen Einfall! Sie erhob sich, wischte sich die Tränen aus den Augen, und fragte ihn, der sich an einem Pult niedergesetzt hatte: ob er ihr die Bittschrift geben, und sie, ",46065,46449,0.0,not_cited
"statt seiner, nach Berlin gehen",46449,46480,1.0,cited
" lassen wolle, um sie dem Landesherrn zu überreichen. Kohlhaas, von dieser Wendung, ",46480,46564,0.0,not_cited
um mehr als einer Ursach willen,46564,46595,1.0,cited
", gerührt, zog sie auf seinen Schoß nieder, und sprach: ",46595,46651,0.0,not_cited
"liebste Frau, das ist nicht wohl möglich! Der Landesherr ist vielfach umringt, mancherlei Verdrießlichkeiten ist der ausgesetzt, der ihm naht.",46651,46793,1.0,cited
" Lisbeth versetzte, daß es in tausend Fällen einer Frau leichter sei, als einem Mann, ihm zu nahen. ",46793,46893,0.0,not_cited
"Gib mir die Bittschrift, wiederholte sie; und wenn du weiter nichts willst, als sie in seinen Händen wissen, so verbürge ich mich dafür: er soll sie",46893,47041,1.0,cited
" bekommen! Kohlhaas, der von ihrem Mut sowohl, als ihrer Klugheit, mancherlei Proben hatte, fragte, wie sie es denn anzustellen denke; worauf sie, indem sie verschämt vor sich niedersah, erwiderte: daß ",47041,47243,0.0,not_cited
"der Kastellan des kurfürstlichen Schlosses, in früheren Zeiten, da er zu Schwerin in Diensten gestanden, um sie geworben",47243,47363,1.5,cited
" habe; daß derselbe zwar jetzt verheiratet sei, und mehrere Kinder habe; daß sie aber ",47363,47449,0.0,not_cited
immer noch nicht ganz vergessen,47449,47480,1.0,cited
" wäre; – und kurz, daß er es ihr nur überlassen möchte, ",47480,47536,0.0,not_cited
"aus diesem und manchem andern Umstand, der zu beschreiben zu weitläufig",47536,47607,1.0,cited
" wäre, Vorteil zu ziehen. ",47607,47633,0.0,not_cited
"Kohlhaas küßte sie mit vieler Freude, sagte, daß er ihren Vorschlag annähme, belehrte sie, daß es weiter nichts bedürfe, als einer Wohnung bei der Frau desselben, um den Landesherrn, im Schlosse selbst, anzutreten, gab ihr die Bittschrift, ließ die Braunen anspannen, und schickte sie mit Sternbald, seinem treuen Knecht, wohleingepackt ab.",47633,47973,1.3333333333333333,cited
"
",47973,47974,0.0,not_cited
"Diese Reise war aber von allen erfolglosen Schritten, die er in seiner Sache getan hatte, der allerunglücklichste.",47974,48088,4.0,cited
" Denn schon nach wenig Tagen zog Sternbald in den Hof wieder ein, Schritt vor Schritt den Wagen führend, in welchem die Frau, ",48088,48214,0.0,not_cited
mit einer gefährlichen Quetschung an der Brust,48214,48260,2.0,cited
", ausgestreckt darnieder lag. ",48260,48290,0.0,not_cited
"Kohlhaas, der bleich an das Fuhrwerk trat, konnte nichts Zusammenhängendes über das, was dieses Unglück verursacht hatte, erfahren.",48290,48421,1.0,cited
" Der Kastellan war, wie der Knecht sagte, nicht zu Hause gewesen; man war also genötigt worden, ",48421,48517,0.0,not_cited
"in einem Wirtshause, das in der Nähe des Schlosses",48517,48567,1.0,cited
" lag, abzusteigen; dies Wirtshaus hatte Lisbeth am andern Morgen verlassen, und dem Knecht befohlen, bei den Pferden zurückzubleiben; ",48567,48701,0.0,not_cited
"und eher nicht, als am Abend, sei sie, in diesem Zustand, zurückgekommen.",48701,48774,1.0,cited
 ,48774,48775,0.0,not_cited
"Es schien, sie hatte sich zu dreist an die Person des Landesherrn vorgedrängt, und, ohne Verschulden desselben, von dem bloßen rohen Eifer einer Wache, die ihn umringte, einen Stoß, mit dem Schaft einer Lanze, vor die Brust erhalten.",48775,49008,3.090909090909091,cited
 ,49008,49009,0.0,not_cited
"Wenigstens berichteten die Leute so, die sie, in bewußtlosem Zustand, gegen Abend in den Gasthof brachten;",49009,49115,1.0,cited
 ,49115,49116,0.0,not_cited
"denn sie selbst konnte, von aus dem Mund vorquellendem Blute gehindert, wenig sprechen.",49116,49203,1.3333333333333333,cited
 ,49203,49204,0.0,not_cited
Die Bittschrift war ihr nachher durch einen Ritter abgenommen worden.,49204,49273,1.3333333333333333,cited
" Sternbald sagte, daß es sein Wille gewesen sei, sich gleich auf ein Pferd zu setzen, und ihm von diesem unglücklichen Vorfall Nachricht zu geben; doch sie habe, trotz der Vorstellungen des herbeigerufenen Wundarztes, darauf bestanden, ohne alle vorgängige Benachrichtigungen, zu ihrem Manne nach Kohlhaasenbrück abgeführt zu werden. ",49273,49607,0.0,not_cited
"Kohlhaas brachte sie, die von der Reise völlig zugrunde gerichtet worden war, in ein Bett, wo sie, unter schmerzhaften Bemühungen, Atem zu holen, noch einige Tage lebte.",49607,49776,1.0,cited
 ,49776,49777,0.0,not_cited
"Man versuchte vergebens, ihr das Bewußtsein",49777,49820,1.0,cited
" wiederzugeben, ",49820,49836,0.0,not_cited
"um über das, was vorgefallen war, einige Aufschlüsse zu erhalten; sie lag, mit starrem, schon gebrochenen Auge, da, und antwortete nicht.",49836,49973,1.0,cited
" Nur kurz vor ihrem Tode kehrte ihr noch einmal die Besinnung wieder. Denn da ein Geistlicher lutherischer Religion (zu welchem eben damals aufkeimenden Glauben sie sich, nach dem Beispiel ihres Mannes, bekannt hatte) neben ihrem Bette stand, und ihr mit lauter und empfindlich-feierlicher Stimme, ein Kapitel aus der Bibel vorlas: so sah sie ihn plötzlich, mit einem finstern Ausdruck, an, nahm ihm, als ob ihr daraus nichts vorzulesen wäre, die Bibel aus der Hand, blätterte und blätterte, und schien etwas darin zu suchen; und zeigte dem Kohlhaas, der an ihrem Bette saß, mit dem Zeigefinger, den Vers: »",49973,50580,0.0,not_cited
"Vergib deinen Feinden; tue wohl auch denen, die dich hassen.",50580,50640,6.0,cited
« – ,50640,50644,0.0,not_cited
"Sie drückte ihm dabei mit einem überaus seelenvollen Blick die Hand, und starb.",50644,50723,1.5,cited
 – ,50723,50726,0.0,not_cited
"Kohlhaas dachte: »so möge mir Gott nie vergeben, wie ich dem Junker vergebe!« küßte sie, indem ihm häufig die Tränen flossen, drückte ihr die Augen zu, und verließ das Gemach.",50726,50901,2.6,cited
" Er nahm die hundert Goldgülden, die ihm der Amtmann schon, für die Ställe in Dresden, zugefertigt hatte, und ",50901,51011,0.0,not_cited
"bestellte ein Leichenbegängnis, das weniger für sie, als für eine Fürstin, angeordnet schien",51011,51103,3.4,cited
: ,51103,51105,0.0,not_cited
"ein eichener Sarg, stark mit Metall beschlagen, Kissen von Seide, mit goldnen und silbernen Troddeln, und ein Grab von acht Ellen Tiefe, mit Feldsteinen gefüttert und Kalk. Er stand selbst, sein Jüngstes auf dem Arm, bei der Gruft, und sah der Arbeit zu. Als der Begräbnistag kam, ward die Leiche, weiß wie Schnee, in einen Saal aufgestellt, den er mit schwarzem Tuch hatte beschlagen lassen. Der Geistliche hatte eben eine rührende Rede an ihrer Bahre vollendet, als ihm die landesherrliche Resolution auf die Bittschrift zugestellt ward, welche die Abgeschiedene übergeben hatte, des Inhalts: er solle die Pferde von der Tronkenburg abholen, und bei Strafe, in das Gefängnis geworfen zu werden, nicht weiter in dieser Sache einkommen. Kohlhaas steckte den Brief ein, und ließ den Sarg auf den Wagen bringen. Sobald der Hügel geworfen, das Kreuz darauf gepflanzt, und die Gäste, die die Leiche bestattet hatten, entlassen waren, warf er sich noch einmal vor ihrem, nun verödeten Bette nieder, und übernahm sodann das Geschäft der Rache.",51105,52142,3.533333333333333,cited
 ,52142,52143,0.0,not_cited
"Er setzte sich nieder und verfaßte einen Rechtsschluß, in welchem er den Junker Wenzel von Tronka, kraft der ihm angeborenen Macht, verdammte, die Rappen, die er ihm abgenommen, und auf den Feldern zugrunde gerichtet, binnen drei Tagen nach Sicht, nach Kohlhaasenbrück zu führen, und in Person in seinen Ställen dick zu füttern.",52143,52471,4.545454545454546,cited
 ,52471,52472,0.0,not_cited
"Diesen Schluß sandte er durch einen reitenden Boten an ihn ab, und instruierte denselben, flugs nach Übergabe des Papiers, wieder bei ihm in Kohlhaasenbrück zu sein.",52472,52637,1.0,cited
 ,52637,52638,0.0,not_cited
"Da die drei Tage, ohne Überlieferung der Pferde, verflossen, so rief er Hersen;",52638,52717,1.0,cited
" eröffnete ihm, was er dem Jungherrn, die Dickfütterung derselben anbetreffend, aufgegeben; fragte ihn zweierlei, ob er mit ihm nach der Tronkenburg reiten und den Jungherrn holen; auch, ",52717,52904,0.0,not_cited
"ob er über den Hergeholten, wenn er bei Erfüllung des Rechtsschlusses, in den Ställen von Kohlhaasenbrück, faul sei, die Peitsche führen wolle?",52904,53047,2.0,cited
" und da Herse, sowie er ihn nur verstanden hatte: »Herr, heute noch!« aufjauchzte, und, indem er die Mütze in die Höhe warf, versicherte: einen Riemen, mit zehn Knoten, um ihm das Striegeln zu lehren, lasse er sich flechten! ",53047,53272,0.0,not_cited
"so verkaufte Kohlhaas das Haus, schickte die Kinder, in einen Wagen gepackt, über die Grenze;",53272,53365,1.0,cited
" rief, bei Anbruch der Nacht, auch ",53365,53400,0.0,not_cited
"die übrigen Knechte zusammen, sieben an der Zahl",53400,53448,1.0,cited
", treu ihm jedweder, wie Gold; bewaffnete und beritt sie, und brach nach der Tronkenburg auf.
",53448,53542,0.0,not_cited
"Er fiel auch, mit diesem kleinen Haufen, schon, beim Einbruch der dritten Nacht, den Zollwärter und Torwächter, die im Gespräch unter dem Tor standen, niederreitend, in die Burg, und während, unter plötzlicher Aufprasselung aller Baracken im Schloßraum, die sie mit Feuer bewarfen, Herse, über die Windeltreppe, in den Turm der Vogtei eilte, und den Schloßvogt und Verwalter, die, halb entkleidet, beim Spiel saßen, mit Hieben und Stichen überfiel, stürzte Kohlhaas zum Junker Wenzel ins Schloß. Der Engel des Gerichts fährt also vom Himmel herab;",53542,54089,3.7333333333333334,cited
" und der Junker, der eben, ",54089,54116,0.0,not_cited
"unter vielem Gelächter, dem Troß junger Freunde, der bei ihm war",54116,54180,1.3333333333333333,cited
", ",54180,54182,0.0,not_cited
"den Rechtsschluß, den ihm der Roßkamm übermacht hatte, vorlas",54182,54243,1.0,cited
", hatte nicht sobald dessen Stimme im Schloßhof vernommen: als er den Herren schon, plötzlich leichenbleich: Brüder, rettet euch! zurief, und verschwand. ",54243,54397,0.0,not_cited
"Kohlhaas, der, beim Eintritt in den Saal, einen Junker Hans von Tronka, der ihm entgegen kam, bei der Brust faßte, und in den Winkel des Saals schleuderte, daß er sein Hirn an den Steinen versprützte, fragte, während die Knechte die anderen Ritter, die zu den Waffen gegriffen hatten, überwältigten, und zerstreuten: wo der Junker Wenzel von Tronka sei?",54397,54750,3.8181818181818183,cited
" Und da er, bei der Unwissenheit der betäubten Männer, die Türen zweier Gemächer, die in die Seitenflügel des Schlosses führten, mit einem Fußtritt sprengte, und in allen Richtungen, ",54750,54933,0.0,not_cited
in denen er das,54933,54948,1.0,cited
" weitläufige Gebäude durchkreuzte, niemanden fand, so stieg er fluchend ",54948,55020,0.0,not_cited
in den Schloßhof hinab,55020,55042,1.0,cited
", um die Ausgänge besetzen zu lassen. ",55042,55080,0.0,not_cited
"Inzwischen war, vom Feuer der Baracken ergriffen, nun schon das Schloß, mit allen Seitengebäuden, starken Rauch gen Himmel qualmend, angegangen, und während Sternbald, mit drei geschäftigen Knechten, alles, was nicht niet- und nagelfest war, zusammenschleppten, und zwischen den Pferden, als gute Beute, umstürzten, flogen, unter dem Jubel Hersens, aus den offenen Fenstern der Vogtei, die Leichen des Schloßvogts und Verwalters, mit Weib und Kindern, herab.",55080,55538,3.0,cited
" Kohlhaas, dem sich, als er die Treppe vom Schloß niederstieg, ",55538,55601,0.0,not_cited
"die alte, von der Gicht geplagte Haushälterin, die dem Junker die Wirtschaft führte",55601,55684,1.0,cited
", zu Füßen warf, fragte sie, indem er auf der Stufe stehenblieb: wo der Junker Wenzel von Tronka sei? und da sie ihm, mit schwacher, zitternder Stimme, zur Antwort gab: sie glaube, er habe sich in die Kapelle geflüchtet; so rief er zwei Knechte mit Fackeln, ließ, in Ermangelung der Schlüssel, den Eingang ",55684,55990,0.0,not_cited
"mit Brechstangen und Beilen eröffnen, kehrte Altäre und Bänke",55990,56051,1.0,cited
" um, und fand gleichwohl, zu seinem grimmigen Schmerz, den Junker nicht. Es traf sich, daß ein junger, zum Gesinde der Tronkenburg gehöriger Knecht, in dem Augenblick, da Kohlhaas aus der Kapelle zurückkam, herbeieilte, um aus einem weitläufigen, steinernen Stall, den die Flamme bedrohte, die Streithengste des Junkers herauszuziehen. Kohlhaas, der, in ebendiesem Augenblick, in einem kleinen, mit Stroh bedeckten Schuppen, seine beiden Rappen erblickte, fragte den Knecht: warum er die Rappen nicht rette? und da dieser, indem er den Schlüssel in die Stalltür steckte, antwortete: der Schuppen stehe ja schon in Flammen, so warf Kohlhaas den Schlüssel, nachdem er ihn mit Heftigkeit aus der Stalltüre gerissen, über die Mauer, trieb den Knecht, ",56051,56798,0.0,not_cited
"mit hageldichten, flachen Hieben der Klinge, in den brennenden Schuppen hinein",56798,56876,1.3333333333333333,cited
", und zwang ihn, ",56876,56893,0.0,not_cited
"unter entsetzlichem Gelächter der Umstehenden, die Rappen zu retten.",56893,56961,2.0,cited
" Gleichwohl, als der Knecht schreckenblaß, wenige Momente nachdem der Schuppen hinter ihm zusammenstürzte, ",56961,57068,0.0,not_cited
"mit den Pferden, die",57068,57088,1.0,cited
" er an der Hand hielt, daraus hervortrat, fand er den Kohlhaas nicht mehr; und da er sich zu den Knechten auf den Schloßplatz begab, und den Roßhändler, der ihm mehreremal den Rücken zukehrte, fragte: was er mit den Tieren nun anfangen solle? – ",57088,57333,0.0,not_cited
"hob dieser plötzlich, mit einer fürchterlichen Gebärde, den Fuß, daß der Tritt, wenn er ihn getan hätte, sein Tod gewesen wäre: bestieg, ohne ihm zu antworten, seinen Braunen",57333,57507,1.0,cited
", setzte ",57507,57516,0.0,not_cited
"sich unter das Tor der Burg, und erharrte, inzwischen die Knechte ihr Wesen forttrieben, schweigend den Tag.",57516,57624,2.2,cited
"
Als der Morgen anbrach, war das ganze Schloß, bis auf die Mauern, niedergebrannt, und niemand befand sich mehr darin, als Kohlhaas und seine sieben Knechte. Er stieg vom Pferde, und untersuchte noch einmal, beim hellen Schein der Sonne, den ganzen, in allen seinen Winkeln jetzt von ihr erleuchteten Platz, und da er sich, so schwer es ihm auch ward, überzeugen mußte, ",57624,57994,0.0,not_cited
daß die Unternehmung auf die Burg fehlgeschlagen war,57994,58046,1.0,cited
", so schickte er, ",58046,58064,0.0,not_cited
die Brust voll Schmerz und Jammer,58064,58097,2.5,cited
", Hersen mit einigen Knechten aus, um über die Richtung, die der Junker auf seiner Flucht genommen, Nachricht einzuziehen. Besonders beunruhigte ihn ein reiches Fräuleinstift, namens Erlabrunn, das an den Ufern der Mulde lag, und dessen Äbtissin, Antonia von Tronka, als eine fromme, wohltätige und heilige Frau, in der Gegend bekannt war; denn es schien dem unglücklichen Kohlhaas nur zu wahrscheinlich, daß der Junker sich entblößt von aller Notdurft, wie er war, in dieses Stift geflüchtet hatte, indem die Äbtissin seine leibliche Tante und die Erzieherin seiner ersten Kindheit war. Kohlhaas, nachdem er sich von diesem Umstand unterrichtet hatte, bestieg den Turm der Vogtei, in dessen Innerem sich noch ein Zimmer, zur Bewohnung brauchbar, darbot, und verfaßte ein sogenanntes »Kohlhaasisches Man dat«, worin er das Land aufforderte, dem Junker ",58097,58949,0.0,not_cited
"Wenzel von Tronka, mit dem er in einem gerechten Krieg liege",58949,59009,1.5,cited
", keinen Vorschub zu tun, vielmehr ",59009,59044,0.0,not_cited
"jeden Bewohner, seine Verwandten und Freunde nicht ausgenommen, verpflichtete, denselben bei Strafe Leibes und des Lebens, und unvermeidlicher Einäscherung alles dessen, was ein Besitztum heißen mag, an ihn",59044,59250,2.375,cited
" auszuliefern. Diese Erklärung streute er, ",59250,59293,0.0,not_cited
"durch Reisende und Fremde, in der Gegend aus;",59293,59338,1.5,cited
" ja, er gab Waldmann, dem Knecht, eine Abschrift davon, mit dem bestimmten Auftrage, sie in die Hände der Dame Antonia nach Erlabrunn zu bringen. Hierauf besprach er einige Tronkenburgische Knechte, die mit dem Junker unzufrieden waren, und ",59338,59579,0.0,not_cited
von der Aussicht auf Beute gereizt,59579,59613,1.0,cited
", in seine Dienste zu treten wünschten; bewaffnete sie, nach Art des Fußvolks, mit Armbrüsten und Dolchen, und lehrte sie, hinter den berittenen Knechten aufsitzen; und nachdem er alles, was der Troß zusammengeschleppt hatte, zu Geld gemacht und das Geld unter denselben verteilt hatte, ruhete er einige Stunden, unter dem Burgtor, von seinen jämmerlichen Geschäften aus.
Gegen Mittag kam Herse und bestätigte ihm, was ihm ",59613,60036,0.0,not_cited
"sein Herz, immer auf die trübsten Ahnungen gestellt",60036,60087,1.0,cited
", schon gesagt hatte: nämlich, daß der Junker in dem Stift zu Erlabrunn, bei der alten Dame Antonia von Tronka, seiner Tante, befindlich sei. Es schien, er hatte sich, durch eine Tür, die, an der hinteren Wand des Schlosses, in die Luft hinausging, über eine schmale, steinerne Treppe gerettet, die, unter einem kleinen Dach, zu einigen Kähnen in die Elbe hinablief. Wenigstens berichtete Herse, daß er, in einem Elbdorf, zum Befremden der Leute, die wegen des Brandes in der Tronkenburg versammelt gewesen, um Mitternacht, in einem Nachen, ohne Steuer und Ruder, angekommen, und mit einem Dorffuhrwerk nach Erlabrunn weitergereiset sei. – – – Kohlhaas seufzte bei dieser Nachricht tief auf; er fragte, ob die Pferde gefressen hätten? und da man ihm antwortete: ja, so ließ er den Haufen aufsitzen, und stand schon in drei Stunden vor Erlabrunn. Eben, unter dem Gemurmel eines entfernten Gewitters am Horizont, mit Fackeln, die er sich vor dem Ort angesteckt, zog ",60087,61051,0.0,not_cited
er mit seiner Schar in den Klosterhof ein,61051,61092,1.0,cited
", und Waldmann, der Knecht, der ihm entgegentrat, meldete ihm, daß das Mandat richtig abgegeben sei, als er die Äbtissin und den Stiftsvogt, in einem verstörten Wortwechsel, ",61092,61266,0.0,not_cited
unter das Portal des Klosters,61266,61295,1.0,cited
" treten sah; und während jener, der Stiftsvogt, ein kleiner, alter, schneeweißer Mann, grimmige Blicke auf Kohlhaas schießend, sich den Harnisch anlegen ließ, und den Knechten, die ihn umringten, mit dreister Stimme zurief, die Sturmglocke zu ziehn: trat jene, die Stiftsfrau, ",61295,61572,0.0,not_cited
das silberne Bildnis des Gekreuzigten in der Hand,61572,61621,1.0,cited
", bleich, wie Linnenzeug, von der Rampe herab, und warf sich mit allen ihren Jungfrauen, vor Kohlhaasens Pferd nieder. Kohlhaas, während Herse und Sternbald den Stiftsvogt, der kein Schwert in der Hand hatte, überwältigten, und als Gefangenen zwischen die Pferde führten, fragte sie: wo der Junker Wenzel von Tronka sei? und da sie, einen großen Ring mit Schlüsseln von ihrem Gurt loslösend: in Wittenberg, Kohlhaas, würdiger Mann! antwortete, und, mit bebender Stimme, hinzusetzte: ",61621,62104,0.0,not_cited
fürchte Gott und tue kein Unrecht!,62104,62138,1.0,cited
" – so wandte Kohlhaas, ",62138,62161,0.0,not_cited
in die Hölle unbefriedigter Rache zurückgeschleudert,62161,62213,3.5,cited
", das Pferd, und war im Begriff: steckt an! zu rufen, als ",62213,62271,0.0,not_cited
"ein ungeheurer Wetterschlag, dicht neben ihm, zur Erde niederfiel.",62271,62337,2.0,cited
" Kohlhaas, indem er sein Pferd zu ihr zurückwandte, fragte sie: ob sie sein Mandat erhalten? und da die Dame mit schwacher, kaum hörbarer Stimme, antwortete: eben jetzt! – »Wann?« – Zwei Stunden, so wahr mir Gott helfe, nach des Junkers, meines Vetters, bereits vollzogener Abreise! – – – und Waldmann, der Knecht, zu dem Kohlhaas sich, unter finsteren Blicken, umkehrte, stotternd diesen Umstand bestätigte, indem er sagte, daß die Gewässer der Mulde, vom Regen geschwellt, ihn verhindert hätten, früher, als eben jetzt, einzutreffen: so sammelte sich Kohlhaas; ",62337,62900,0.0,not_cited
"ein plötzlich furchtbarer Regenguß, der die Fackeln verlöschend, auf das Pflaster des Platzes niederrauschte, löste den Schmerz in seiner unglücklichen Brust; er wandte, indem er kurz den Hut vor der Dame rückte, sein Pferd, drückte ihm, mit den Worten: folgt mir meine Brüder; der Junker ist in Wittenberg! die Sporen ein, und verließ das Stift.",62900,63246,1.6363636363636365,cited
"
Er kehrte, da die Nacht einbrach, in einem Wirtshause auf der Landstraße ein, wo er, wegen großer Ermüdung der Pferde, einen Tag ausruhen mußte, und da er wohl einsah, ",63246,63415,0.0,not_cited
"daß er mit einem Haufen von zehn Mann (denn so stark war er jetzt), einem Platz wie Wittenberg war, nicht trotzen konnte, so verfaßte er ein zweites Mandat, worin er, nach einer kurzen Erzählung dessen, was ihm im Lande begegnet, »jeden guten Christen«, wie er sich ausdrückte, »unter Angelobung eines Handgelds und anderer kriegerischen Vorteile«, aufforderte »seine Sache gegen den Junker von Tronka, als dem allgemeinen Feind aller Christen, zu ergreifen",63415,63872,2.25,cited
«. ,63872,63875,0.0,not_cited
"In einem anderen Mandat, das bald darauf erschien, nannte er sich: »einen Reichs-und Weltfreien, Gott allein unterworfenen Herrn«; eine Schwärmerei krankhafter und mißgeschaffener Art",63875,64058,6.454545454545454,cited
", die ihm gleichwohl, bei dem Klang seines Geldes und der Aussicht auf Beute, unter dem ",64058,64146,0.0,not_cited
